{
  "$schema": "./_profile.schema.json",
  "schema_version": 1,
  "id": "strelitzia",
  "name": "Bird of paradise",
  "scientific_name": "Strelitzia spp.",
  "varieties": [
    {"id": "nicolai", "name": "Giant white (S. nicolai)", "note": "The big indoor one: trunk-forming, leaves to two metres, white and blue flowers outdoors."},
    {"id": "reginae", "name": "Bird of paradise (S. reginae)", "note": "Clumping and smaller, with the orange and blue flower. Wants more direct sun than nicolai to bloom."},
    {"id": "juncea", "name": "Narrow-leaf (S. juncea)", "note": "Rolled, rush-like leaves with almost no blade. Slower and more drought-tolerant than the others."}
  ],
  "root_zone": {
    "moisture_percent": {"label": "Soil moisture", "unit": "%", "scale": [0, 100]},
    "soil_temperature_c": {"label": "Soil temperature", "unit": "°C", "ideal": [18, 27], "scale": [10, 35]},
    "conductivity_us_cm": {"label": "Pore-water EC", "unit": "µS/cm", "ideal": [500, 1500], "scale": [0, 3000]}
  },
  "watering": {
    "strategy": "partial_dry_back",
    "label": "Let the soil dry well between waterings",
    "refill_below": 18,
    "post_water_target": [35, 55],
    "comfortable_cycle": [18, 55],
    "concern_below": 10,
    "concern_above": 65
  },
  "drainage": {
    "label": "Free draining with moderate moisture retention",
    "preferred_response": "balanced",
    "acceptable_responses": ["fast", "balanced"],
    "maximum_settle_minutes": 20
  },
  "climate": {
    "air_temperature_c": {"label": "Air temperature", "unit": "°C", "ideal": [18, 29], "scale": [10, 35]},
    "air_humidity_percent": {"label": "Air humidity", "unit": "%", "ideal": [40, 60], "scale": [20, 90]}
  },
  "chemistry": {
    "soil_ph": {"label": "pH", "unit": "", "ideal": [5.5, 7.0], "scale": [4.0, 9.0]},
    "nitrogen_mg_kg": {"label": "Nitrogen", "unit": "mg/kg", "ideal": [60, 120], "scale": [0, 200]},
    "phosphorus_mg_kg": {"label": "Phosphorus", "unit": "mg/kg", "ideal": [30, 70], "scale": [0, 140]},
    "potassium_mg_kg": {"label": "Potassium", "unit": "mg/kg", "ideal": [80, 160], "scale": [0, 240]}
  }
}