{
  "$schema": "./_profile.schema.json",
  "schema_version": 1,
  "id": "jasmine",
  "name": "Jasmine",
  "scientific_name": "Jasminum spp.",
  "varieties": [
    {"id": "polyanthum", "name": "Pink jasmine (J. polyanthum)", "note": "The one sold in bud in winter. It needs four to six weeks of cool nights, around 10-13 °C, in autumn to set buds: kept warm all year it makes leaves and no flowers."},
    {"id": "sambac", "name": "Arabian jasmine (J. sambac)", "note": "Tropical and warmth-loving: it flowers through the heat of summer and wants no cool period. The least cold-tolerant of them; keep it above 13 °C."},
    {"id": "officinale", "name": "Common jasmine (J. officinale)", "note": "The hardiest, and summer-flowering. Happiest with a cool, drier winter rest, after which it flowers on new growth."},
    {"id": "grandiflorum", "name": "Spanish jasmine (J. grandiflorum)", "note": "Long flowering and tender, grown for its scent. Treated as J. officinale but kept warmer."},
    {"id": "nitidum", "name": "Angel-wing jasmine (J. nitidum)", "note": "Shrubbier than the climbers and tender. It flowers on new growth, so prune after a flush rather than before one."}
  ],
  "root_zone": {
    "moisture_percent": {"label": "Soil moisture", "unit": "%", "scale": [0, 100]},
    "soil_temperature_c": {"label": "Soil temperature", "unit": "°C", "ideal": [16, 26], "scale": [10, 35]},
    "conductivity_us_cm": {"label": "Pore-water EC", "unit": "µS/cm", "ideal": [600, 1600], "scale": [0, 3000]}
  },
  "watering": {
    "strategy": "even_moisture",
    "label": "Keep evenly moist while in leaf; a full dry-out costs the buds",
    "refill_below": 40,
    "post_water_target": [62, 78],
    "comfortable_cycle": [40, 78],
    "concern_below": 25,
    "concern_above": 88
  },
  "drainage": {
    "label": "Moisture-retentive mix that still drains; a flowering vine drinks faster than it looks",
    "preferred_response": "balanced",
    "acceptable_responses": ["balanced", "retaining"],
    "maximum_settle_minutes": 25
  },
  "climate": {
    "air_temperature_c": {"label": "Air temperature", "unit": "°C", "ideal": [16, 26], "scale": [5, 35]},
    "air_humidity_percent": {"label": "Air humidity", "unit": "%", "ideal": [50, 70], "scale": [20, 90]}
  },
  "chemistry": {
    "soil_ph": {"label": "pH", "unit": "", "ideal": [6.0, 7.5], "scale": [4.0, 9.0]},
    "nitrogen_mg_kg": {"label": "Nitrogen", "unit": "mg/kg", "ideal": [60, 120], "scale": [0, 200]},
    "phosphorus_mg_kg": {"label": "Phosphorus", "unit": "mg/kg", "ideal": [35, 80], "scale": [0, 140]},
    "potassium_mg_kg": {"label": "Potassium", "unit": "mg/kg", "ideal": [100, 190], "scale": [0, 240]}
  }
}
